<?xml version="1.0" encoding="utf-8"?>
<!-- edited with XMLSpy v2011 rel. 2 (http://www.altova.com) by Venom (ICO) -->
<ClassDataItemList Type="Type1" Name="MyClass" Color="Color1" xmlns:xsi="http://www.w3.org/2001/XMLSchema-instance" xsi:noNamespaceSchemaLocation="ClassDataItem.xsd">
  <ClassDataItem ItemType="Fields" Name="field1" ReturnType="string" Color="Color1" Scope="Scope1" AccessSpecifier="private" Static="true" Signature="Signature1" Parameternames="Parameternames1" IsConstructor="false" DisplayData="DisplayData1"/>
  <ClassDataItem ItemType="Fields" Name="myNumber" ReturnType="long" Color="Color1" Scope="Scope1" AccessSpecifier="private" Static="false" Signature="Signature1" Parameternames="Parameternames1" IsConstructor="false" DisplayData="DisplayData1"/>
  <ClassDataItem ItemType="Fields" Name="cnt" ReturnType="int" Color="Color1" Scope="Scope1" AccessSpecifier="public" Static="false" Signature="Signature1" Parameternames="Parameternames1" IsConstructor="false" DisplayData="DisplayData1"/>
  <ClassDataItem ItemType="Fields" Name="_substractor" ReturnType="byte" Color="Color1" Scope="Scope1" AccessSpecifier="private" Static="false" Signature="Signature1" Parameternames="Parameternames1" IsConstructor="false" DisplayData="DisplayData1"/>
  <ClassDataItem ItemType="Properties" Name="HasValue" ReturnType="bool" Color="Color3" Scope="Scope3" AccessSpecifier="private" Static="false" Signature="Signature3" Parameternames="Parameternames3" IsConstructor="false" DisplayData="DisplayData3"/>
  <ClassDataItem ItemType="Properties" Name="IsDingens" ReturnType="bool" Color="Color3" Scope="Scope3" AccessSpecifier="protected" Static="false" Signature="Signature3" Parameternames="Parameternames3" IsConstructor="false" DisplayData="DisplayData3"/>
  <ClassDataItem ItemType="Properties" Name="TargetName" ReturnType="string" Color="Color3" Scope="Scope3" AccessSpecifier="public" Static="false" Signature="Signature3" Parameternames="Parameternames3" IsConstructor="false" DisplayData="DisplayData3"/>
  <ClassDataItem ItemType="Methods" Name="Constructor" ReturnType="void" Color="Color2" Scope="Scope2" AccessSpecifier="public" Static="false" Signature="Signature2" Parameternames="Parameternames2" IsConstructor="true" DisplayData="DisplayData2"/>
  <ClassDataItem ItemType="Methods" Name="ToString()" ReturnType="string" Color="Color2" Scope="Scope2" AccessSpecifier="protected" Static="true" Signature="Signature2" Parameternames="Parameternames2" IsConstructor="false" DisplayData="DisplayData2"/>
  <ClassDataItem ItemType="Methods" Name="Remove()" ReturnType="void" Color="Color2" Scope="Scope2" AccessSpecifier="public" Static="false" Signature="Signature2" Parameternames="Parameternames2" IsConstructor="false" DisplayData="DisplayData2"/>
  <ClassDataItem ItemType="Methods" Name="Initialize()" ReturnType="void" Color="Color2" Scope="Scope2" AccessSpecifier="private" Static="false" Signature="Signature2" Parameternames="Parameternames2" IsConstructor="false" DisplayData="DisplayData2"/>
  <ClassDataItem ItemType="Events" Name="NotifyPropertyChanged" Color="Color3" Scope="Scope3" AccessSpecifier="public" Static="false" Signature="Signature3" Parameternames="Parameternames3" IsConstructor="false" DisplayData="DisplayData3"/>
  <ClassDataItem ItemType="Events" Name="MyEvent" Color="Color3" Scope="Scope3" AccessSpecifier="public" Static="false" Signature="Signature3" Parameternames="Parameternames3" IsConstructor="false" DisplayData="DisplayData3"/>
  <ClassDataItem ItemType="Events" Name="Clicked" Color="Color3" Scope="Scope3" AccessSpecifier="public" Static="false" Signature="Signature3" Parameternames="Parameternames3" IsConstructor="false" DisplayData="DisplayData3"/>
</ClassDataItemList>
